{
    "backgroundColor": "#333333",
    "colorSpace": {
        "Primaries": {
            "Blue": {},
            "Green": {},
            "Red": {},
            "WhitePoint": {}
        }
    },
    "grid": {
        "alias": " A demo alias",
        "location": "a1"
    },
    "text": [
        "sample",
        "text"
    ],
    "textColor": "#C2A649",
    "type": "builtin.textbox"
}